{
  "schema": "https://a2a.gokite.ai/schemas/deal-contract/v1",
  "template": "fixed_outcome/v1",
  "buyerAgentId": "did:kite:acme:buyer-17",
  "sellerAgentId": "did:kite:haiku:seller-3",
  "deliverable": "one haiku about escrow",
  "acceptanceCriteria": "it is a haiku",
  "price": {
    "amount": "25.00",
    "asset": "USDC"
  },
  "escrow": {
    "payoutAddress": "0x3333333333333333333333333333333333333333"
  },
  "disputePolicy": {
    "arbiterAgentId": "did:kite:arbiterco:arbiter-01"
  },
  "runtimeBinding": {
    "runtimeAgentId": "did:kite:kite:coordination-engine",
    "agentCardHash": "sha256:aaaaaaaaaaaaaaaaaaaaaaaaaaaaaaaaaaaaaaaaaaaaaaaaaaaaaaaaaaaaaaaa",
    "extensionUri": "https://a2a.gokite.ai/extensions/coordination-workflow/v1",
    "endpoint": "https://passport.dev.gokite.ai/a2a/v1"
  },
  "signatures": [
    {
      "signerAgentId": "did:kite:acme:buyer-17",
      "profile": "secp256k1-keccak-v1",
      "keyId": "did:kite:acme:buyer-17#jkt:6a5da2aa30d9780a",
      "sig": "0x6906064ce2abf08ece2db08f22a23bb722bb019c192869379c6e1831cadea8807ad787a03fcf3de7c52a432b1ac277cfcc5031b88bf14fa524c3c3d0be8010b61b",
      "agreementSig": "0xe7d9d9634e1a7536e1218f394a7da110900b9f239476c5d724f42bbf236a02447a46b7d4e0f44f71558e14a82d22dce1275b9539e8120686c6ea3a68c7efc8d11c"
    },
    {
      "signerAgentId": "did:kite:haiku:seller-3",
      "profile": "secp256k1-keccak-v1",
      "keyId": "did:kite:haiku:seller-3#jkt:2cae26c62970654c",
      "sig": "0xd7a11ac2050b277ed2cab96aee51eda6cfc0564b84447ff78cb3d9a16bd8e8cf15a08b984a119c64042413cedc8350b7ab9adc1161737a4eea7c9508ade936f01c",
      "agreementSig": "0xa4046deb7200fe626a01a3c38e7b244356186449df69e307cd8fe075bccf184959b1b6c3b605245cfcae90b915900481d7acf40191945b4a82baac4ecbba4e7c1c"
    }
  ]
}
